,comment
0,for a film with such sad violent deaths the mother meeting her ancestors was such a beautiful scene
1,mollies mothers death scene was incredible so well done
2,one detail i notice is when ernest interrogated by tom white and his men flies are associated with him and prominent in the scene to the point that ernest tries to swat it as if theyre attracted to him a fly also lands near him during the scene when mollie tells him that hes next as theyre in the house when the fields in hales ranch is on fire
3,the amount of information scorsese packed into the scene when earnest walks off the train is just amazing the social dynamics are completely topsyturvy for the era it was set in seeing white chauffeurs and white men sitting around waiting to jump on a truck for work was just uncanny and lets you know exactly what the situation is
4,so sad how the funerals started out  osage culturally and by the last funeral of the film they were void of any osage tradition
5,molly inadvertently showing hospitality to byron after he just killed her sister destroyed me
6,i love when ernest is trying to get the insulin box from the doctors his daughter elizabeth is hugging his leg and clinging onto him its pretty adorable to see moments like that in a very serious and tense film like this
7,one of my favorite things is that tom white jesse plemons character shows up in like the last hour of the movie and with very little effort he figures out what happens its not that the conspiracy was masterminded and brilliant people just didnt care to stop it
8,i love how easy it was for the fbi to piece it together literally just asked a witness off the street and they pretty much wrapped up the case right there
9,whats the reason that these independent educated and wealthy indian women keepon marrying the white man even after all the suspicious death what was the historical context that made these indian woman marrying white man that are clearly significantly below their social class
10,who else cracked up every time de niro had his goggles on
11,fuck a duck
12,absolutely incredible how good deniro is at  years old dudes been doing this for  years and still throws  miles an hour
13,i cracked up in the theater when dicaprio dapped up that kkk member lmao like oh yeah of course these motherfuckers are racist
14,lily gladstone was absolutely amazing and stole the movie
15,i love that scene where mollie imagines hale coming to finish her off
16,once again scorsese has a scene where the main character has to point to de niro from the witness stand got a chuckle out of that
17,who had leonardo dicaprio getting spanked by robert de niro on your bingo card for this year
18,well i wanted to make sure it was legal before i do it in reference to murdering children my theater simultaneously burst out laughing while going jesus fucking christ at this scene
19,funnily this felt like such a personal story to scorsese nearly four hours long and there is no glitz no glamour no big needle drops no crazy camera moves he put himself in the backseat and let the story and the tragedy carry itself throughout the film that is until the very ending at first i didnt really enjoy the ending it felt jarring and out of step with the rest of the movie but i think it cements the theme of the entire movie as the movie develops we see time and again how the white people continually try to exploit the osage people they have money and white people far and wide come to try and sell them things try to scam them osage prices rob them marry them and murder them they are dehumanized treated as inferior and turned into a type of sick game by the colonizers so the story builds and we get to the trial we have seen all of the immoral and evil actions hale and burkhart have committed we have the two wellknown actors playing the big whig lawyers about to duke it out in a climactic court scene where we will finally get to see justice and then it cuts to a new scene a scene that is not simple but instead a scene that is dynamic and energetic that shows you all of the behind the scenes tricks to making a fun and entertaining story and you realize that there wasnt any justice william hale ernest and byron all essentially got away with their crimes and instead of it being remembered as a tragedy the story of the murders was again exploited by white people and turned into entertainment and while scorsese is clearly affected by the story he puts himself on the stage with the other exploiters as he recognizes that he too is using their story to create entertainment however i think his transparency goes a long way to reinforce his overall theme that native american people have been exploited robbed dehumanized and murdered by european colonizers for hundreds of years and it continues to this day
20,the scene of the mother dying and being welcomed to the after life was absolutely beautiful and may end up being one of my favorite scenes in a scorsese movie that being juxtaposed with the sadness at the funeral and feeling the impending doom thatll be brought down on the family was overwhelming
21,that was  hours and  minutes of me feeling like shit for lily gladstone
22,i personally thought it was a really bold cinematic choice to have the movies most dramatic moments scored by taylor swift faintly playing in the next room
23,the scene where de niro basically said the hotdog car meme were all looking for the guy who did this when he offered to add  dollars to find out who killed mollies sister
24,if theres one lesson to take away from this ignorance and evil are two sides of the same coin the big question the film asks is where ernests stupidity ends and his complicity begins but ultimately they take you to the same destination
25,i just realized the connection between the owl the osage see right before death and hales owllike appearance with those round glasses this movie was so good
26,i appreciated that they didnt shy away from the brutality when they lifted rita and the back of her head was gone having to see and listen to annas skull being sawed off the atrocities are sickening and those scenes made you sit with it
27,nobody leo in the last m 
28,is there a word for that was amazing and incredibly difficult to watch were the funny moments actually funny or just not so damn heavy it made them seem funnier i dont often get excited for movies and i almost rarely go to movies and havent been on opening night since lotr but damn that was worth the hype imo
29,this film redefined why de niro is one of if not the greatest actors who ever lived he embodied fucking satan in this
30,ive seen a few reviews that say the movie is cold and keeps the viewer at an emotional distance but i teared up several times lily gladstone was such a strong presence and her breaking down every time she lost a family member was hard to watch also the scene where her mother dies and is led away by those three spirits hit me pretty hard also jesse plemons showed up so late into the movie that i had forgotten he was in it i really loved the change in momentum when he and the fbi come into the story the movie was expertly paced in that regard
31, year old jesse plemons calling  year old leo dicaprio son in the last act took me the fuck out haha
32,very confused why the couple second scene with the dead dog was left in there non book readers would be very confused in the book if memory serves correct the dog is killed so that they can plant the explosives in the house without being detected the book actually takes time to explain it
33,this and the irishman really show how scorceses evolved with portraying the main criminals compared to his older works where theres still a level of coolness to the gangsters even with the films indicting the characters and lifestyles here theres none of it ernest is just pathetic a stooge for his uncle that can only follow orders like a good soldier much like frank in the irishman maybe the funniest scene is ernest getting spanked with a masonpaddle by robert deniro even the redeeming factor of he loved his family is gone because he only loves them because thats what a good man does all while compartmentalizing that with killing mollys family and slowly poisoning her theres no more glamor only ugliness to the criminals it was always there in scorcese films now hes done giving them a veneer to hide behind
34,when molly let out that primal scream on the steps when she found out her sister died man that hit me hard emotionally she sent chills down my spine and ive never instantly teared up in a movie like that before amazing performance
35,this has been mentioned a few times already  having the epilogue play out as a hokey radio play funded by the fbi with actors putting on osage accents and cheesy sound effects with marty the white narrator himself coming out to deliver the closing powerful line was such a fucking necessary moment of self criticism and reflection an incredible level of selfawareness from an  year old scorsese just keeps on growing
36,can you spot the wolves in this picture chefs kiss
37,the old guy who really fucked up the murder he was supposed to do and then told the fbi you boys better grab your pencils when he was about to lay it all out reminded me a lot of harry dean stanton a very harry dean stanton coded character
38,i wish they talked about the detective that got thrown off a train
39,history spoiler i guess is that even a thing disappointed that they didnt include the bit where ernest tried to have his wife and kids stay at ritas house when it was blown up they only survived because his son had an earache and they couldnt leave came into this really curious at his they were going to go about that like i guess they left it out to avoid making him seem too evil but why include the bit about the earache then
40,man that last scene between leo and lily was heartbreaking
41,watching ernests reactions to the bombing and the fire insurance scam man you can see how much hes affected how horrified he is you keep praying for him to finally do the right thing and he just never does
42,it is very long but i dont know how it could be cut it was a very tragic story
43,the scene in the mason lodge with the reflection of a chess board in the glasses was some really cool symbolism
44,it was an incredibly thoughtful movie i will admit the movie is long but i was super interested in all of it without question its a very wellmade movie but more importantly its just a shockingly insane and tragic story im glad nolan was the one to tell oppenheimers story and im glad it was marty who chose to tell this one
45,im in love with the balance of dialogue in this film it was an absolute masterclass in wordless emoting and nuance the moments that tell you the most about a character are often when they say the least scorsese omits subtitles in some scenes so youre scrutinizing leo and lilys faces and suddenly you realize you didnt need the subtitles to understand leos more relaxed charming expressions in the first act are juxtaposed hard with his contorted confused suffering grimaces in the final hour lily conveys unimaginable heartache with simple glances down to the very last of her scenes honestly this was some of the best acting ive seen in my life there might be three academy awards for performances here so much of less is more is put on display its stated explicitly as a trait of the osage  they waste no breath when it isnt necessary and william hale spends the whole film yapping
46,man i got chills and teary eyed when marty came out at the end lily gladstone killed it i felt the film suffered a bit when she was so sick because she wasnt in it enough i loved how she was very traditional but yet super modern almost the way she laughed and flirted and stuff i mostly had some technical issues that brought me down a little some choice edits the scene of one of the osage man getting killed that looked very day for night people have mentioned the music score and i barely recall any of it was mostly amazed only two people in my theater left for a bathroom break and one woman left with about ten minutes left in the film
47,i havent read the book but was there some underlying point of ernest being below iq i have no idea how to phrase it but even when he is talking with hale at the beginning and even throughout he seems so clueless as to what is happening around him that its almost spun as if he wasnt in on it that may have been a filmmaking choice but for the first hour to hour and a half he seemed like he was on the side of the osage and strings were being pulled that he couldnt see the only reason i drive that point home is because he was so taken aback by signing away his rights should he basically be needed to be killed how could you not see that coming should it come to it the guy is a piece of shit but it felt like the movie was too sympathetic towards him if that makes sense
48,its only implied through a quick line de niro has something like did he say it was me but the book outright states that it was likely annas unborn child was hales
49,friendly reminder that william king hale was a real person who actually did all that
50,between jack white jason isbell and sturgill simpson the actors in this would make one hell of a band
51,underrated moment is the initial tribal council where they announce the reward money and appoint that guy to go to washington the tribal leaders absolutely crushed their two brief moments in the film
52,scorsese is alive now into his s and yet he has not stopped riding the lightning as a filmmaker the ending to this movie still has me spiralling an hour after seeing it the sheer scale of this horrific and disgusting time being reflected upon and then used as the ultimate weapon at the end is one of the most powerful endings to a movie i have ever seen i honestly believe this is one of if not the best movie martin scorsese has ever made it may very well be my favourite dicaprio and de niro have rarely been better gladstone will win an oscar the pacing the writing the cinematography all contribute to make such a harrowing and brutal story come to life and remind us to defy king hales insistence that people will forget i have not felt so impacted by a movie since i watched  years a slave for the first time im dead serious
53,lily gladstone was just the most perfect in this role her regality her beauty her strength and compassion were expertly played i would be hard pressed to believe there will be a more oscarworthy performance this season im curious if anyone else knowing scorseses catholic roots felt like there were virgin mary vibes with how he portrayed molly or was it just me either way just a great job and personally worth watching it just for her cant wait to see the next thing she does
54,i see why people didnt like frasiers acting in this but honestly i loved it i just love a theatrical grandiose lawyer hamming it up for the jury and for his clients you dumb boy
55,saw this in tulsa tonight  osage ladies had me take their picture before the movie with traditional skirts and blankets was honored to take the picture
56,i really liked that last scene with ernest and molly i was thinking the whole time its over they both have to know that how the hell could she ever forgive him but she really looked ready to after all that she recognizes that he loves her she gives him a chance to tell the truth lay it all out and start again insulin wrong answer
57,how about that score that deep delta percussion with light harmonica almost like the stones had a part of it perfection
58,scorsese did a great job differentiating the movie from the book i read the book in anticipation for the movie and would recommend it to anyone that enjoyed the movie the book is more structured around the fbi investigation and tom white whereas the film is moreso a story about mollie and her family  not to say the book doesnt cover it it does but id say it had the opportunity to expand further on the fbi due to the benefit of a written medium overall however the movie was incredible and its amazing to me that scorsese can continue to make these thoughtful and expertly crafted movies at his age the pacing was fantastic and there wasnt a time i felt as though the runtime was not justified did anyone notice that there was background music playing for almost every scene i wonder if that played a role in flowing the movie together from scene to scene without it being abrupt or jarring
59,nobody gunna talk about how molly ask the potus to send for help and then responds with maybe  words and sends a dozen fbi agents to figure the whole thing out thats why they called him silent cal
60,not to be nit picky but did anyone notice that the soundmixing seemed a bit off there were a couple of scenes that sounded like they had to be redubbed
61,anyone else have the next theater over blaring taylor swift for  and a half hours i will always remember this film as the one that had the taylor swift soundtrack during the quiet scencesaka most of the movie
62,one thing that really struck me was that this movie felt like an anticrimeprocedural two references really sprang to mind for me finchers zodiac and kurosawas high and low zodiac is similar in that its this sprawling hopeless investigation with matteroffact depictions of brutality and very controlled formal techniques high and low came to mind because of that scene where tom white plemons was standing around with his team and they were laying out their conclusions intercut with the scenes of them conducting their investigation this is very similar to the legendary middle section of high and low both these movies are procedural movies that really sweep you up in the process of investigation and accumulation of clues and details that lead you towards a cathartic conclusion in zodiacs case i guess that there really isnt a conclusion but scorsese strips out this procedure and mystery entirely where the book functioned as a procedural in the same manner as something like zodiac at first i was kind of frustrated by this decision as the investigation in the book really exposed the level of the conspiracy and how hopeless it all seemed whereas it kinda feels like white swoops in at the end here and wraps it up relatively easily but i think this was a purposeful decision by scorsese to completely rob you of any and all catharsis that could be experienced by watching an investigation be conducted and succeed instead were forced to just sit in the agony of following these horrible people bumble their way through these crimes and completely get away with it its like wolf of wall street if you just stripped any sense of glamor and flashiness from that film so you were just left with the worst most horrific parts
63,i am pretty annoyed they changed that ernest had meant to blow up the rest of his family his own wife and children when he blew up his sister in laws house that was a big reveal at the end of the book when his son admitted his father thought they were going to stay over there the night the explosion happened
64,did anyone notice that the audio became pretty bad at some scenes there was one scene i remember where it sounded pretty bad clearly adred where leonardo yells repeatedly at the guy to do the kill job immediately
65,the cameo with scorsese at the end was honestly one of the best and most memorable ending scenes ive ever seen in a movie
66,i want all factual epilogues in the future to be done in the way marty did it wow that was actually a phenomenal and heartfelt way to play out what happened to everyone from this story in addition just incredible performances all around especially by lily leo and deniro they were all magnetic in their roles and while it can feel a bit fascinating at first to see leo and deniro acting together like uncle and nephew they blend in perfectly by the halfway point when the semitwist is revealed as to how involved leo is with the kings behavior absolutely unbelievable what scorsese can still do at  i feel honored i can still watch new films from him cant wait for the wager
67,my lame claim to fame is that the son of my moms yoga instructor plays mollie and ernests kid
68,there is so much sorrow in lily gladstones eyes she plays this very stoic seeming character but every time i saw her i could feel the weight of every death and betrayal in her family feels like the first hour of this gives away what martin was desiring with the rest of the film preservation the history of the osage told through a book photos capturing just the faces and clothes of the people and their joy as they played sports or enjoyed luxuries all of these forms of preservation juxtaposed with their mass murder theres a beautiful narrative told to display the planned and systemic destruction of a people a statement to show that this was not something done naturally over time there was no slow replacement or natural shift in people it was deliberate planned and agreed on conspiracy by coyotes to shift wealth from one hand to another i personally found the ending so moving and effective it was a major risk to end this massive story with something as simple as a reenactment bringing the films own worth into question it feels like there was supposed to be another ending but scorsese wanted it stated plainly these people existed they suffered and then they were tossed aside and buried in the sand of history
