,comment
69,simply blown away stunning sickening film while i was more entertained by oppenheimer id argue this is the better film on a quality level scorsese has seemingly unending energy to keep making films bless him but this would very much work as his swan song  this may well be the best performance ive seen from leo ive always loved his acting despite agreeing with the notion that he performs the same way in everything but he completely disappeared into this character the way he transforms ernest from this seemingly slow gullible halfwaycharming troublemaker into a way more sinister presence was hypnotic to watch  dicaprio is strongest during the movies third act where scorseses camera really studies his face in long unheld shots and lets it tell the story it begins with the scene when he gets arrested and detained while still sobering up and continues to when he denounces hale gives his testimony a truly stunning scene and finally that breathtaking final scene between he and mollie  lily gladstone holy crap the beating heart of this horrifying tale scorsese is deadon that her eyes communicate an entire world atop what the script and direction afford i assumed from the marketing that shed be this toughasnails nobullshit character but gladstone imbued mollie  indeed a person of deep intelligence and resolve  with a remarkable gentleness and sensitivity which made her story all the more tragic her only crime was trusting ernest and for that she was given a life of loss and suffering and still loved him until the terrible truth finally came out  mollie surviving was the biggest surpriserelief of the film i read varietys review from cannes a few months ago and they spoiled the fact that ernest poisons mollie which i thought would be some gutpunch reveal ending in tragedy it was of course agonizing to watch her slowly die at ernests hands and my heart sank every time they showed her getting worse assuming it would end inevitably but it instead served as the basis for mollie finally learning what a spineless bastard her husband was a small yet palpable victory in what was otherwise a grotesque miscarriage of justice  robert de niro was _the devil incarnate_ in this film just a stirring performance i was especially impressed by how he never turned hale into a mustachetwirling villain he was just slimy underhanded and entitled brazen in his evil and pathetic in his conniving ways rather than build up his villainy through scary monologues or violent outbursts like in his gangster films scorsese used the other characters weaknesses to reaffirm hales own power hale simply had to manipulate other greedy weak bigoted men into doing his bidding and spends most of the movie sweettalking the other characters into doing favors for him the crimes of course get increasingly grotesque and unconscionable  very interesting seeing two acclaimed country musicians sturgill simpson and jason isbell get prominent acting parts here and effortlessly hold their own against powerhouses like dicaprio and de niro i especially loved simpson great screen presence felt awful for isbells character  the spanking scene was fucking hilarious felt like a callback to when jack nicholson beats up dicaprios alreadybroken arm in the departed but it was way more comical the way scorsese set it up as this frightening cultlike initiation made it even funnier  those two doctors were a reprehensible nasty pair wish we saw them brought to justice i thought one of them the one with hair was the dude from the first mission impossible movie whos there when tom cruise hangs from the ceiling but i checked the cast and its a different actor  the scenes where hale sets up both blackie and aceys downfalldeaths was incredible the one scene in the movie that most resembled scorseses gangster movies  the moment i saw scott shepherd playing ernests brother i knew hed be bad news they always cast him as these villanous creeps and he nails it every time though i was lessthanimpressed with his acting on the last of us  brendan fraser and especially john lithgow were great in their limited screentime plemons usual deadpan act fell a little flat here but he was by no means bad and i loved seeing his whole squad finally dismantle the conspiracy  like oppenheimer the other threehour epic released this year this movie did start getting a tad tedious in the third act which again focused more on legalpolitical matters the editing in particular got a bit loopy in the way it kept jumping between the trial the jail cell and mollie as well as yanking ernest in and out of jail but it all came together in stunning fashion in the final segments i didnt expect ernest to have any kind of turnaround whatsoever so his testimony was a pleasant surprise  that whole radio show conclusion was totally surreal there were pieces discussed there that i wouldve loved to see play out onscreen despite the movies already huge runtime but it was an incredibly unique and potent way to end the film scorsese showing up on camera was a wild moment and speaks to how this film works as an excellent sendoff should he decide hes done making films there was palpable real emotion on his face as he read out what happened to mollie  the other thing that made this movie stand out in scorseses filmography was its moral clarity most of scorseses other movies are rather morally grey but this was a crystal clear indictment of an unspeakable evil that was slowly and consciously perpetrated upon innocent people scorsese has made a career out of dismantling americas favorite myths  the lawless gangster days the decadence and greed of wall street  and now he takes on the legacy of this countrys foundational sin  the western setting the macabre murdermystery plot and the theme of using religion to influence systemic corruption all reminded me quite heavily of true detective while the focus on crimes against indigenous tribes reminded me of wind river which is also told in a very atmospheric slowburning neowestern style scorsese can really nail any and every genre a master for sure
70,lily gladstones weeping during the mostly silent framescene of her mothers death is by far one of the most beautiful and memorable shots i have seen all year the production on this film was colossal
71,oppenheimer  killers of the flower moon villains with glasses that embody four eyes zero soul to their core
72,embarrassing questions  what are they holding up in the first scene of the movie  why do they ask leo to leave the funeral
73,this movie was a true epic long and reaching but paced well incredible performances and a truly tragic story of murder and systemic betrayal honestly a great director doing true crime is the kind of shit i like and this did not disappoint what i cant get away from with this movie is just how abhorrent these crimes were and scorcese knows just how to depict them to make them a true gut punch but remain respectful to the victims this isnt just murder its systemic genocide and theres not really a scene where everyone meets and plans this grand conspiracy all the white men just kind of know what their end goal is and they befriend and marry these people just to treat them like livestock and use them for resource lilly gladstone is going to be on every shortlist for acting awards this season and she absolutely deserves it this whole movie is terrible awful things happening to her and her family and while we know whos doing it we still feel her deep paranoia and mistrust what an awful feeling that must be to be afraid to eat in your own house and to look around one day and realize that half your community has been leading you to a slaughterhouse for money harrowing stuff and she puts it all on her shoulders it took me a minute to start getting on board with this movie i did feel like the trailer made it seem like an investigative movie so i kept waiting for plemons to show up which happens at the two hour mark but after seeing the whole picture its much more disturbing that we know whats happening the entire time its actually so refreshing when plemons does show up and start asking simple questions like youre telling me this man was married to your deceased sister and two weeks later he married your other sister its crazy how brazenly and blatantly in public and daylight these crimes were carried out all it took was for someone to be assigned to care to finally come around and put two and two together and how quickly it all started unspooling as soon as that element is introduced to the county i liked how the guy assigned to kill the melancholic started to become friends with him and its the fact that he had to force himself to do the murder that made him forget to make it look like a suicide a small glimmer of humanity in what is otherwise an awful story of communal evil whats depressing and far too real about this movie though is exactly what de niro says people will forget because no one cares the final scene of the radio show really got to me not only the mention that mollys obituary never mentioned her story but how marty showed up to give a kind of personal care to those final words its awful that things like this and the invoked tulsa massacre arent taught anywhere and instead explored on podcasts by people who have to dig up this information the ending really brought that home for me  rreviewsbyboner
74,who were the racist old people and random other white people at the burkhardt residence during the scene where the old people chastise the kids for being half savage you just see all these people milling about in their house and then never see them again
75,pretty surprised people are upset that it changed the focusstructure of the book i enjoyed the book its an important story and grann has good prose but its a pretty bythenumbers police procedural scorsese isnt interested in doing a longer episode of law and order focusing on molly and ernest is much more compelling
76,oh my fucking god theres so many things i can talk about dicaprio has maybe my favorite performance ever no one was prepared for how good de niro was in this film gladstone had probably the best nonverbal acting in the film her presence spoke louder than everyone else i know he had one of the weaker performances in this film but fraser getting work inherently makes me happy the occasional weird editing was the only issue i had but my god that ending thats the thing i want to talk about the most it completely changed the purpose of the film the commodification of the horrors of native americans and crime in general really just struck me and i feel like that was the point especially with scorseses role in it before his line my main takeaway from the film was the greed of humanity and how it struck the osage people but after that line i realized that this film wants to be about how our understanding and treatment of native american history is broken and this is just a small case in a history of horror i genuinely want to pursue more native american history after this and i feel like thats what scorsese wanted all along this film is just a small step in what he wants and how he wants to make the world better
77,jesus i found that one shot near the end of the film so haunting molly shows such kindness to ernests brother as he comes home late at night setting him down on a pillow and tucking him in juxtaposed with the casual coldness of what ernest had been doing that evening the way he and his accomplice to it with such a lack of regard and then slip away shrug off the magnitude of it just a really brilliant bit of editing and directing
78,i loved the shot of all the detectives gathering at night to share what they found
79,best de niro since casino truly heartbreaking the only issue i had with the movie was the score that played the entire movie got a little distracting loved the religious imagery scenes like the owl and lizzie passing away supporting cast was stellar the what happened after scene at the end was awesome them touching on the tulsa race massacre was a good megaphone for the themes of the film would be a little hamfisted in the wrong hands
80,felt like watching an entire season of fargo
81,jesus its been a long time since a movie made me so angry ernest is such a fucking reprehensible scumbag its incredible lily gladstone fucking killed it btw
82,surprised i havent seen anyone talk about hale saying he was as innocent as a newborn baby very funny coming from a guy whos catholic
83,man this one got me this is what studios need to spend m on  enabling the absolute best directors actors and craftsman alive to tell important stories in an engaging cinematic way this was just so fucking great i dont know how anything beats this out for best picture
84,i enjoyed how well this portrayed the attitudes at the time and how indian territory was viewed i personally appreciated how not all the spoken wazhazhe ie was submitted as an osage person and language learner living in texas i was probably the only one in the theater who understood some of those dialog exchanges i appreciate how something like that can speak to different audience members in different ways theres also so many details and particulars that people wouldnt notice as important or uniquely osage unless they had that cultural context and i like that those are just there but not over there explained you either know or you dont and that really makes it feel like this move was made for us
85,david lynch cameo at the end of the fabelmans  martin scorsese cameo at the end of killers of the flower moon
86,well boys get out your pencils
87,scorsese always has a way of wrapping up his films by bringing the theme all back home what was a harrowing day by day hell for the osage people was nothing more than an advertisement for cigarettes at the end it was a story told to entertain but commented on how thats so often all that it is i found it very appropriate then that marty himself got the last line about mollies obituary here was a film made with grace that took the time to see the ordeal from the perspective of the people whose ordeal this was in the first place i wasnt expecting it but i just wept at the end all that death and it ended up being for nothing there was no mention of the murders
88,what scorsese does at the end of this film is fucking incredible dont want to spoil it but only a director of his confidence and talent could pull it off
89,ernest the whole movie 
90,if i had a nickel for every film i saw this year with a charismatic friend of the protagonist with gray hair and glasses who was secretly a nefarious narcissistic villain played to perfection by a dude named robert who is definitely up for best supporting actor id have two nickels which isnt a lot but its weird it happened twice
91,i spent most of this movie not fully getting ernest as a character kept wondering if he was just simple if he had some other motivation it wasnt until the last act that it hit me hes just a piece of shit theres nothing else no dialogue that i didnt hear no subtext in his interactions that i didnt pick up on my confusion came purely from not believing someone could be such a piece of shit
92,leos turn into billy bob from sling blade two hours in was something
93,i know a lot of the talk with be of how good leo was but man i really was captivated by de niro every scene he was in a faces covering faces sort of performance
94,if youre seeing killers of the flower moon this weekend be sure to stay through the end credits there are two postcredits scenes teasing scorsese phase  and tying together the entire mafiaverse
95,i thought this was an absolute masterpiece this thing feels gargantuan in scope and the level of uneasiness and dread throughout is almost unbearable at times leonardo dicaprio and robert de niro are both fucking fantastic de niro is the best hes been in  years probably but lily fucking gladstone is transcendant i loved everything about this and will be going back before it leaves theatres 
96,shout out to the score at some point during the second hour i became horrifyingly aware that that heartbeat bass track was sucking anything good and holy out of me
97,saw this tonight lily gladstone dominates there is a cold dark evil in this world
98,want to share my thoughts after seeing this movie this is from the perspective from someone who read the book recently and was absolutely captivated by it the movie was great however i felt as if i left the theatre with something missing the acting setting cinematography camera work was all excellent these events took place over the course of many years so i understand the challenge of how you would have to cram all of this within a  and half hour film while they do a great job with it i think for the sake of telling the story some of the events could of been left out and viewers could of been left with a more flowing narrative when you read it from david granns perspective it reads like a mystery you dont know right away it was hale because he was big figure that appeared so generous and active within the community part of you thinks ernest would never do these things to his family or spouse the movie took a different approach with the story starting off right away showing who the protagonist would be and focusing on hale di nero and ernst leo they obviously got the majority of camera time in this story should they have that could be debated the story of the investigation and fbi could of been a movie of itself i know martin s had to chose what perspective and narrative to share with the viewers i think they could of focused more on the story being told from the osage perspective i did catch some parts where they shared some of manipulation around when they were doing things like buying cars or getting photos taken everyone was in on taking advantage of them the movie was great but wanted to share some little points i could spend hours talking about other aspects of the film or ways this story could of been told
99,fuck a duck lily gladstone was electric in this
100,great movie but man brendan fraser was miscast audience was giggling every time he shouted
101,for his acting debut jason isbell was phenomenal in this
102,why was ernest asked to leave the funeral
